[
  {
    "changed_signal_ids": [
      "agent-interaction-contracts",
      "audiyo-low-vram",
      "cobra-skills",
      "convention-gap",
      "microsoft-safe-participation",
      "school-ai-privacy-standard"
    ],
    "edition_date": "2026-09-13",
    "edition_id": "2026-09-13-0656",
    "edition_url": "https://aoifuture.com/news/2026-09-13-0656/",
    "event_id": "aoi-news-2026-09-13-0656-r001",
    "event_kind": "edition-published",
    "published_at": "2026-09-13T06:56:08+09:00",
    "revision": 1,
    "schema_version": "aoi.news.edition-event.v1",
    "summary": "スキル最適化と人・AI協働の暗黙知を深掘り。継続する操作契約、学校のAI保護、若年層の参加設計、低VRAM音声生成を追う。",
    "title": "AOIFUTURE News：協働の暗黙知を測り、権限と保護を設計する"
  }
]
