[
  {
    "changed_signal_ids": [
      "agentproto-20260922",
      "arxiv-agent-kernel-security",
      "hermes-agent-0214",
      "hf-omlx-maintenance",
      "hf-transformers-gguf",
      "jetbrains-air-agentic-development"
    ],
    "edition_date": "2026-09-23",
    "edition_id": "2026-09-23-0050",
    "edition_url": "https://aoifuture.com/news/2026-09-23-0050/",
    "event_id": "aoi-news-2026-09-23-0050-r001",
    "event_kind": "edition-published",
    "published_at": "2026-09-23T00:50:42+09:00",
    "revision": 1,
    "schema_version": "aoi.news.edition-event.v1",
    "summary": "エージェントを特権主体として守る設計と、開発・ローカルAI基盤の運用更新を深掘りする。",
    "title": "AOIFUTURE News：エージェントを動かす前に、境界と運用を設計する"
  }
]
